{
  "eventId": "01a14da1-a7df-7197-9a8b-d3c3f8dc9430",
  "eventType": "extraction.completed",
  "schemaVersion": 1,
  "occurredAt": "2026-10-18T06:10:02.335Z",
  "producer": "extraction",
  "payload": {
    "rawPostId": "00000000-0000-7000-8000-68f38a8f19b2",
    "rawVersion": 1,
    "field": "HOUSING",
    "title": "서초구 서리풀 청년아트타운 잔여세대 입주자 모집공고",
    "conditions": [
      {
        "id": "eligibility-arts-proof",
        "target": "문화예술분야 청년예술인",
        "targetGroups": [
          "문화예술분야 청년예술인"
        ],
        "category": "OTHER",
        "description": "문화예술 분야에 종사하고, 예술활동증명서 또는 관련 협회 발급 예술인 증명서류로 예술인임을 증명할 수 있어야 합니다.",
        "originalText": "「문화예술진흥법」에 따른 문화예술 분야에 종사하며, 한국예술인복지재단의예술활동증명서 또는관련협회에서발급한예술인증명서류를통해예술인증명이가능한자",
        "referenceTime": "입주자 모집 공고일(2026. 10. 16.) 기준",
        "rule": {
          "expression": null,
          "reason": "문화예술 분야 종사 및 예술인 증명서류 제출 요건은 속성 사전으로 표현할 수 없습니다.",
          "status": "UNSTRUCTURED"
        },
        "exceptions": [],
        "inReview": false,
        "reviewReasons": []
      },
      {
        "id": "eligibility-age",
        "target": "문화예술분야 청년예술인",
        "targetGroups": [
          "문화예술분야 청년예술인"
        ],
        "category": "AGE",
        "description": "공고일 기준 19세 이상 39세 이하인 청년이어야 합니다.",
        "originalText": "서울시에주민등록등재된19세이상~39세이하(1986.10.17.~2007.10.16.출생)인청년",
        "referenceTime": "입주자 모집 공고일(2026. 10. 16.) 기준",
        "rule": {
          "expression": {
            "attribute": "AGE_YEARS",
            "basis": "공고문에는 1986.10.17.~2007.10.16. 출생이라고 기재되어 있습니다.",
            "benchmark": null,
            "kind": "ATOMIC",
            "operator": "BETWEEN",
            "referenceTime": "입주자 모집 공고일(2026. 10. 16.) 기준",
            "subject": "APPLICANT",
            "unit": "YEAR",
            "value": [
              19,
              39
            ],
            "evidenceIds": [
              "ev-23"
            ]
          },
          "reason": null,
          "status": "STRUCTURED"
        },
        "exceptions": [],
        "inReview": false,
        "reviewReasons": []
      },
      {
        "id": "eligibility-seoul-resident",
        "target": "문화예술분야 청년예술인",
        "targetGroups": [
          "문화예술분야 청년예술인"
        ],
        "category": "RESIDENCE",
        "description": "신청자는 서울시에 주민등록이 등재되어 있어야 합니다.",
        "originalText": "서울시에주민등록등재된19세이상~39세이하(1986.10.17.~2007.10.16.출생)인청년",
        "referenceTime": "입주자 모집 공고일(2026. 10. 16.) 기준",
        "rule": {
          "expression": null,
          "reason": "서울시 주민등록 등재 요건은 사전의 법정동코드 값으로 원문에 제시되어 있지 않아 구조화할 수 없습니다.",
          "status": "UNSTRUCTURED"
        },
        "exceptions": [],
        "inReview": false,
        "reviewReasons": []
      },
      {
        "id": "eligibility-homeless-household",
        "target": "문화예술분야 청년예술인",
        "targetGroups": [
          "문화예술분야 청년예술인"
        ],
        "category": "HOME_OWNERSHIP",
        "description": "신청자를 포함한 세대원 전원이 무주택 세대구성원이어야 합니다. 공고문은 분리된 배우자 및 해당 주민등록표의 일부 직계존비속 등을 자격검증대상에 포함하고, 무주택세대구성원 정의에서 외국인을 제외한다고 안내합니다.",
        "originalText": "세대원(신청자 포함) 전원이 무주택 세대구성원",
        "referenceTime": "입주자 모집 공고일(2026. 10. 16.) 기준",
        "rule": {
          "expression": {
            "attribute": "HOMELESS",
            "basis": "공고문에서 정한 무주택세대구성원 범위에 속하는 세대원 전원(신청자 포함)이 주택을 소유하지 않아야 합니다.",
            "benchmark": null,
            "kind": "ATOMIC",
            "operator": "EQ",
            "referenceTime": "입주자 모집 공고일(2026. 10. 16.) 기준",
            "subject": "HOUSEHOLD",
            "unit": "BOOLEAN",
            "value": true,
            "evidenceIds": [
              "ev-24",
              "ev-25",
              "ev-26"
            ]
          },
          "reason": null,
          "status": "STRUCTURED"
        },
        "exceptions": [],
        "inReview": false,
        "reviewReasons": []
      },
      {
        "id": "eligibility-income-assets-alternative",
        "target": "문화예술분야 청년예술인",
        "targetGroups": [
          "문화예술분야 청년예술인"
        ],
        "category": "INCOME",
        "description": "아래 두 요건 중 하나를 충족해야 합니다. 첫째, 무주택세대구성원 전원의 전년도 도시근로자 월평균 소득 합산액이 50% 이하이고 총자산가액이 2.45억원 이하이며 자동차가액이 4,542만원 이하인 경우입니다. 둘째, 전년도 도시근로자 월평균 소득 합산액이 70% 이하인 경우이며 이 경로에는 자산기준이 없습니다. 공고문은 가구원 수별 월평균 소득 기준액도 함께 제시합니다: 50% 이하 기준은 1인가구 2,669,354원, 2인가구 3,519,762원, 3인가구 4,084,215원, 4인가구 4,401,101원, 5인가구 4,663,493원이고, 70% 이하 기준은 각각 3,432,027원, 4,693,016원, 5,717,900원, 6,161,541원, 6,528,890원입니다.",
        "originalText": "라. 소득 및 자산기준 : 아래요건 중 하나에 해당하는 자 1) 전년도 도시근로자 월평균 소득 50% 이하 및 총자산가액 2.45억원 이하, 자동차가액 4.542만원 이하인 자 2) 전년도 도시근로자 월평균 소득 70% 이하인 자(자산기준 없음)",
        "referenceTime": "입주자 모집 공고일(2026. 10. 16.) 기준",
        "rule": {
          "expression": {
            "children": [
              {
                "children": [
                  {
                    "attribute": "INCOME_BENCHMARK_PERCENT",
                    "basis": "무주택세대구성원 전원의 소득 합산액 기준입니다. 공고문에 가구원 수별 금액표가 함께 제시되어 있습니다.",
                    "benchmark": {
                      "householdMemberCount": null,
                      "householdScope": "무주택세대구성원 전원",
                      "referenceVersion": "전년도",
                      "referenceYear": null,
                      "standardName": "도시근로자 월평균 소득"
                    },
                    "kind": "ATOMIC",
                    "operator": "LTE",
                    "referenceTime": "입주자 모집 공고일(2026. 10. 16.) 기준",
                    "subject": "HOUSEHOLD",
                    "unit": "PERCENT",
                    "value": 50,
                    "evidenceIds": [
                      "ev-27",
                      "ev-29",
                      "ev-30"
                    ]
                  },
                  {
                    "attribute": "TOTAL_ASSETS_KRW",
                    "basis": "부동산가액, 자동차가액, 금융자산가액 및 일반자산가액을 합산하고 부채를 차감하여 산출합니다.",
                    "benchmark": null,
                    "kind": "ATOMIC",
                    "operator": "LTE",
                    "referenceTime": "입주자 모집 공고일(2026. 10. 16.) 기준",
                    "subject": "HOUSEHOLD",
                    "unit": "KRW",
                    "value": 245000000,
                    "evidenceIds": [
                      "ev-28"
                    ]
                  },
                  {
                    "attribute": "CAR_ASSETS_KRW",
                    "basis": "도시근로자 월평균 소득 50% 이하인 자에게 적용되는 자동차가액 기준입니다.",
                    "benchmark": null,
                    "kind": "ATOMIC",
                    "operator": "LTE",
                    "referenceTime": "입주자 모집 공고일(2026. 10. 16.) 기준",
                    "subject": "HOUSEHOLD",
                    "unit": "KRW",
                    "value": 45420000,
                    "evidenceIds": [
                      "ev-28"
                    ]
                  }
                ],
                "kind": "ALL"
              },
              {
                "attribute": "INCOME_BENCHMARK_PERCENT",
                "basis": "무주택세대구성원 전원의 소득 합산액 기준입니다. 공고문에 가구원 수별 금액표가 함께 제시되어 있습니다.",
                "benchmark": {
                  "householdMemberCount": null,
                  "householdScope": "무주택세대구성원 전원",
                  "referenceVersion": "전년도",
                  "referenceYear": null,
                  "standardName": "도시근로자 월평균 소득"
                },
                "kind": "ATOMIC",
                "operator": "LTE",
                "referenceTime": "입주자 모집 공고일(2026. 10. 16.) 기준",
                "subject": "HOUSEHOLD",
                "unit": "PERCENT",
                "value": 70,
                "evidenceIds": [
                  "ev-27",
                  "ev-29",
                  "ev-31",
                  "ev-32"
                ]
              }
            ],
            "kind": "ANY"
          },
          "reason": null,
          "status": "STRUCTURED"
        },
        "exceptions": [],
        "inReview": true,
        "reviewReasons": [
          "TIER_CONDITION_MISSING",
          "VALUE_NOT_IN_QUOTE"
        ]
      },
      {
        "id": "eligibility-one-application-per-household",
        "target": "문화예술분야 청년예술인",
        "targetGroups": [
          "문화예술분야 청년예술인"
        ],
        "category": "HOUSEHOLD",
        "description": "금회 모집대상 주택에는 1세대 1주택만 신청할 수 있으며, 중복 신청은 전부 무효 처리됩니다.",
        "originalText": "금회 모집공고문의 모집대상 주택에 대하여 1세대 1주택 신청을 원칙으로 하며, 중복 신청하는 경우 전부 무효처리 합니다.",
        "referenceTime": "신청 시",
        "rule": {
          "expression": null,
          "reason": "1세대 1주택 신청 및 중복 신청 무효 요건은 속성 사전으로 표현할 수 없습니다.",
          "status": "UNSTRUCTURED"
        },
        "exceptions": [],
        "inReview": false,
        "reviewReasons": []
      }
    ],
    "reviewStatus": "PARTIALLY_PASSED",
    "heldItems": [
      {
        "target": "/eligibility/4",
        "extent": "ITEM",
        "codes": [
          "TIER_CONDITION_MISSING",
          "VALUE_NOT_IN_QUOTE"
        ],
        "description": "확인 전까지 판정·화면에 쓰지 않습니다(원문 확인 필요)"
      }
    ],
    "provider": "shpdf",
    "regionCode": "11650",
    "schedule": {
      "applyStartOn": "2026-10-26",
      "applyEndOn": "2026-10-30"
    },
    "applicationWindows": [
      {
        "scheduleId": "schedule-application",
        "label": "신청접수",
        "applyStartOn": "2026-10-26",
        "applyEndOn": "2026-10-30",
        "priorityRank": null,
        "targetGroups": [],
        "scopeDescription": "공고 전체 신청자에게 적용됩니다."
      }
    ],
    "summary": "청년예술인의 주거 안정과 문화예술활동 커뮤니티 활성화를 위해 서초구와 서울주택도시공사가 협력하여 공급하는 공공임대주택의 잔여세대 입주자를 모집합니다.",
    "reprocess": false,
    "notice": {
      "schemaVersion": "1.0.0",
      "target": "NOTICE",
      "input": {
        "eventId": "00000000-0000-7000-8000-68f38a8fe000",
        "rawPostId": "00000000-0000-7000-8000-68f38a8f19b2",
        "rawVersion": 1,
        "field": "HOUSING",
        "reprocess": false
      },
      "sourceReferences": [
        {
          "sourceCode": "shpdf",